{"$id":"https://cumulativewebinc.github.io/cwi-learn/registry/agent-card-schema.json","$schema":"http://json-schema.org/draft-07/schema#","additionalProperties":true,"description":"Machine-readable discovery card for a CWI product. HF model-card / Glama server-card pattern, adapted: description + tags + license-free pricing honesty + lineage truth labels.","properties":{"capabilities":{"items":{"minLength":3,"type":"string"},"minItems":1,"type":"array"},"card_status":{"minLength":1,"type":"string"},"conversion_note":{"type":"string"},"cta":{"minLength":1,"type":"string"},"description":{"maxLength":400,"minLength":20,"type":"string"},"discovery":{"properties":{"card_in_repo":{"type":["string","null"]},"ci_workflows":{"type":"array"},"repo":{"type":["string","null"]},"try_url_status":{"type":["integer","string","null"]}},"required":["repo","ci_workflows","card_in_repo","try_url_status"],"type":"object"},"display_name":{"minLength":1,"type":"string"},"docs_url":{"format":"uri","type":"string"},"equip":{"type":["string","null"]},"intended_use":{"minLength":10,"type":"string"},"limitations":{"minLength":10,"type":"string"},"lineage_stage":{"minLength":1,"type":"string"},"name":{"minLength":1,"type":"string"},"repo_url":{"format":"uri","type":["string","null"]},"result_lineage":{"items":{"enum":["R1","R2","R3"],"type":"string"},"minItems":1,"type":"array"},"revenue_dna":{"type":"object"},"schema_version":{"const":"cwi-agent-card/1.0.0","type":"string"},"slug":{"pattern":"^[a-z0-9][a-z0-9-]*$","type":"string"},"tags":{"items":{"minLength":2,"type":"string"},"minItems":1,"type":"array"},"truth_label":{"enum":["verified-live","repo-ci","repo-no-ci","staged-unshipped","no-public-repo","unknown"],"type":"string"},"try":{"properties":{"run":{"type":["string","null"]},"url":{"format":"uri","type":["string","null"]}},"required":["url","run"],"type":"object"},"updated":{"pattern":"^\\d{4}-\\d{2}-\\d{2}$","type":"string"},"vendor":{"const":"Cumulative Web Inc","type":"string"},"version":{"minLength":1,"type":"string"}},"required":["schema_version","name","slug","display_name","vendor","version","description","intended_use","capabilities","limitations","try","docs_url","result_lineage","lineage_stage","tags","truth_label","card_status","cta","discovery","updated"],"title":"CWI Agent Card","type":"object"}