{
 "schema_version": "cwi-agent-card/1.0.0",
 "name": "tag-city-3d",
 "slug": "tag-city-3d",
 "display_name": "TAG CITY 3D",
 "vendor": "Cumulative Web Inc",
 "version": "0.1.0",
 "description": "3D city concept under evaluation: IRIS visual gate is the instrument; no shippable build yet.",
 "intended_use": "Future players; currently evaluation only.",
 "capabilities": [
  "IRIS visual-gate evaluation"
 ],
 "limitations": "Pre-cycle: no shippable build, no channel; blocked on Black's call (specialist human hands vs AI image tool).",
 "try": {
  "url": null,
  "run": null
 },
 "equip": null,
 "docs_url": "https://github.com/CumulativeWebInc/cwi-learn",
 "repo_url": null,
 "result_lineage": [
  "R2"
 ],
 "lineage_stage": "built",
 "tags": [
  "3d",
  "concept"
 ],
 "truth_label": "no-public-repo",
 "card_status": "schema-valid (validated 2026-10-01; registry CI enforces)",
 "conversion_note": "No build to verify; evaluation only.",
 "cta": "Blocked on founder's creative call",
 "discovery": {
  "repo": null,
  "ci_workflows": [],
  "card_in_repo": null,
  "try_url_status": null
 },
 "updated": "2026-10-01"
}