{
 "schema_version": "cwi-agent-card/1.0.0",
 "name": "pull-distribution-stats",
 "slug": "pull-distribution-stats",
 "display_name": "pull-distribution-stats (skill)",
 "vendor": "Cumulative Web Inc",
 "version": "1.0.0",
 "description": "Internal measurement skill: GitHub traffic (views/clones) + Hugging Face downloads + trust-log claim count -> one dashboard JSON.",
 "intended_use": "CWI operators (internal).",
 "capabilities": [
  "GitHub traffic API",
  "HF dataset API (BlackLansky/cwi-catalog: 128 downloads)",
  "trust-log chain count (11 claims)"
 ],
 "limitations": "Internal only; not a public try.",
 "try": {
  "url": null,
  "run": null
 },
 "equip": null,
 "docs_url": "https://github.com/CumulativeWebInc/cwi-learn",
 "repo_url": null,
 "result_lineage": [
  "R3"
 ],
 "lineage_stage": "live",
 "tags": [
  "measurement",
  "stats",
  "skill"
 ],
 "truth_label": "no-public-repo",
 "card_status": "schema-valid (validated 2026-10-01; registry CI enforces)",
 "conversion_note": "Smoke-verified healthy against live sources (2026-10-01).",
 "cta": "n/a (internal measurement)",
 "discovery": {
  "repo": null,
  "ci_workflows": [],
  "card_in_repo": null,
  "try_url_status": null
 },
 "updated": "2026-10-01"
}